{
  "schemaVersion": 1,
  "contract": "kelly-asset-history",
  "state": "unavailable",
  "assetId": "stock-spcx",
  "generatedAt": "2026-07-21T00:00:00+09:00",
  "dataAsOf": null,
  "metadata": {
    "symbol": "SPCX",
    "assetType": "equity",
    "exchange": "US",
    "timezone": "America/New_York",
    "returnBasis": "total_return_approximation",
    "baseCurrency": "USD"
  },
  "dates": [],
  "prices": [],
  "returns": [],
  "source": {
    "provider": "none",
    "normalized": true,
    "rawRedistribution": false,
    "license": "No provider observations published",
    "attribution": "No market observations published",
    "cachedAt": null
  },
  "limitations": [
    "provider_rights_not_confirmed",
    "server_secret_not_configured"
  ]
}
