{
  "schemaVersion": 1,
  "contract": "kelly-asset-history",
  "state": "unavailable",
  "assetId": "fx-usd-krw",
  "generatedAt": "2026-07-21T00:00:00+09:00",
  "dataAsOf": null,
  "metadata": {
    "symbol": "USD/KRW",
    "assetType": "fx",
    "exchange": "FX",
    "timezone": "UTC",
    "returnBasis": "fx_rate",
    "baseCurrency": "USD",
    "quoteCurrency": "KRW"
  },
  "dates": [],
  "prices": [],
  "returns": [],
  "source": {
    "provider": "none",
    "normalized": true,
    "rawRedistribution": false,
    "license": "No provider observations published",
    "attribution": "No market observations published",
    "cachedAt": null
  },
  "limitations": [
    "provider_rights_not_confirmed",
    "server_secret_not_configured"
  ],
  "fx": {
    "pair": "USD/KRW",
    "dates": [],
    "rates": [],
    "maxStalenessDays": 3
  }
}
