{
  "schemaVersion": 1,
  "contract": "kelly-asset-history",
  "state": "unavailable",
  "assetId": "kr-005930",
  "generatedAt": "2026-07-22T00:38:16.921758+00:00",
  "dataAsOf": null,
  "metadata": {
    "symbol": "005930.KS",
    "assetType": "equity",
    "exchange": "KRX",
    "timezone": "Asia/Seoul",
    "returnBasis": "price_return",
    "baseCurrency": "KRW"
  },
  "dates": [],
  "prices": [],
  "returns": [],
  "source": {
    "provider": "none",
    "normalized": true,
    "rawRedistribution": false,
    "license": "No public-display approval recorded",
    "attribution": "No market observations published",
    "cachedAt": null
  },
  "limitations": [
    "krx_public_display_rights_unconfirmed"
  ]
}
